original,adversarial,original_label,final_label,success,queries
"If you like good, fresh, sandwiches, then you have to try one here at Lee's. I think the bread is what really makes the difference, it is super fresh and would taste good all by itself! Its much cheaper than any other sandwich shop and definitely seems fresher and less assembly line. I think the only thing that can be hit or miss here is the service from time to time, but that is soon forgotten with a sniff of the fresh bread.  Yes they do only accept cash but that is as they say, to keep the prices down.  I usually order the ham and turkey club and a water and i get out of there for about 5 bucks.  I also love the fresh baked baguettes...so good!",Failed to initialize,1,,False,975
I don't plan on returning. The food was disappointing. The services was just ok. And you have to pay for chips & salsa with your $12 tacos. Give me a break.,Failed to initialize,0,,False,889
The food is fusion Chinese and Indian and it's full of taste. It could be spicy for some ppl but the taste is worthy it,The food is nuclear concretion answer minute set phrase and red-faced American language American Indian and it's rise of taste. selective selective information organise could constitute juicy for about ppl merely the gustatory perception is worthy it,1,0,True,455
"Hands down my favorite Froyo place. My kids love, it, my wife loves it too! It's in our neighborhood and offers quality Froyo!\n\nThe price is right for the quality. The staff is always friendly, and even after a few times remembers who you are. They recently expanded to have Gelato and some other things, in my personal opinion shouldn't have because the Froyo was awesome. \n\nThis is the best place around, wouldn't drive anywhere else!",Failed to initialize,1,,False,886
"Great fresh food! Give yourself time for lunch hour, as it is fresh so it takes a little bit longer but not bad! Not bland! Great service!","slap-up fresh food! Give yourself time for lunch hour, as it is fresh so it takes a little bit longer but not bad! Not bland! expectant service!",1,0,True,188
"I dislike this place, first and last time I come here.  It's sad seeing people standing around talking and on their cell phones.  Placed my order and when I got my burger, it was all wrong. I waited an extra 25 minutes for my fixed burger. Not cool. Never again.",Failed to initialize,0,,False,933
"I came here for my girlfriend's Bday dinner. It was just not up to expectations. Our party of 8 wasnt all there, but they seemed to want to keep us at the bar. Finally after 20 minutes, they finally gave in and let the 5 of us sit down since our other few weren't eating. I found this sort of annoying as the bar was pretty full (we were all in heels) and we asked to be seated a few times... But OOHH well. \n\nServer: Our server was pretty darn occupied with the hostesses. I am in the industry, so I understand how this works. But COMMONNN pay attention to us!! The people in our party had to go up to the bar after we were seated because he was so busy trying to meet the ladies!! \n\nFood Quality: Mine was decent. I had the filet. I felt the mashed potatoes were missing something, they were dying for truffle or something savory. My steak was a little over cooked. \n\nIssue: A girl at our table's steak was WAY undercooked. Our server didnt come around for awhile, so she watched us eat. They re-cooked the same steak to re-cook it. I think this is NASTY. I would expect this at an Applebees, but not here. EW! Dont but a steak that was on a persons germy fork back on the grill!!\n\nPrices: For the food quality... You must be joking! There are much much better places to eat for the same price. \n\nDrink Prices: $16-$40 for their drinks. Pretty pricey, but they are tasty. I dont think they are very strong, we had two BIG ones and we were still sober afterwards... $80 for two. \n\nThey also didnt do ANYTHING for her Bday!! It was a little awkward. I wasn't expecting a song or dance, but a free shot or a comped dessert would have gone a LONG way. Each person in our party left with a $60+ tab. I probably wouldnt go back, its just too pricey for the quality in my opinion. I really wouldnt want to repeat that. \n\nI did meet a super nice club promoter for the club next door. He really hooked my group of friends up, you can message me for his info if you need it. He really saved the night since dinner was kinda Blah.",Failed to initialize,0,,False,909
"So NOT the buffet that I want when I got to Vegas (TAXI!!! quick! take me to the buffet at the RIo!)\n\nAfter waiting for what seemed like forever in line that morning for brunch, we finally got seated.  Then we went thru the buffet - it was so so.  There was nothing spectacular about the food, nothing interesting, or unusual that would make it stand out - nothing that would make me ever want to come back.  \n\nVegas is about trying new foods, and experiencing things, this was not something that I would consider new - or an experience.  it was just blah.",Failed to initialize,0,,False,919
"Easy in, easy out! I also love Whole Foods, but I find that I always buy a bunch of things that look good that I don't need when I go there.  They have most of the same products in their health aisle.  I've been very pleased with the organic produce I have purchased from here.  Keep in mind that it is like a Trader Joes, in the sense that they do carry some non-organic items.  So, for a quick trip, Sprouts does the trick.",Failed to initialize,1,,False,926
"I decided to walk in here on a whim, and kinda regret doing so. The food could have been pretty decent, but it was -extremely- oily. There was a visible puddle of oil left after I scooped the meat and veggies out of the plate they were delivered to, and onto the rice. Outside of that it was fine, it was pleasantly spicy, and would have otherwise been mediocre Chinese food (I prefer thai in any case).\n\nThis is definitely a place geared for delivery. The internal appearance was very dingy, and as another reviewer commented, there are boxes and things sitting around out in the main area. The service wasn't horrible; it's not exactly sit down service; you order from a counter, but I -did- have the food brought to my table. \n\nHad the food not been so greasy (seriously, they could have used 1/4th the oil they did, which still would have been a little much, but certainly within the realm of 'okay' for my standards), and had the internal decor been a bit better (remove the boxes, ensure everything is clean and a bit better lit), and I could see giving this place another star or two...but as it was, I regretted going in.",Failed to initialize,0,,False,943
By far best food on the strip as are as tacos go .. This is as close as it gets to Mexican out side of Mexico!!!' Will for sure be back,By far dearly food on the strip as glucinium as tacos go .. This is as close as it gets to Mexican out slant of Mexico!!!' Will for for sealed glucinium back,1,0,True,184
"I'm not a big fan of pick your ingredients type places.  I'm a crappy cook.  Whatever I come up with will almost certainly be sub-par.  I go out to eat so that professionals can do that part (and the cooking) for me.\n\nI had the Asiago Blue Mac and didn't care for it.  The fact that the menu only has a few pre-defined dishes would have made me believe they should be better thought out.\n\nFor a meal that cost over $10 I'm usually much happier.  I love Mac & Cheese at most places so I was all the more disappointed.  Despite my first experience, I'll likely go back for one more try.",Failed to initialize,0,,False,952
Terry is by far THE best in the biz! Get a airbrush bundle of tans... Because you WILL return and use them!,Terry is by far THE outflank in the biz! Get a airbrush bundle of tans... Because you entrust return and economic place waste to disease them!,1,0,True,370
"To be perfectly (and embarrassingly) honest, I started going to Industry specifically because I knew I would not see anyone that I knew there. Sometimes you just really don't want a place where anybody knows your name. Sometimes you want to be a girl, alone at a bar, drinking a bourbon and reading a book. And Industry fits the bill perfectly. It's a good-looking place with a giant bar area and plenty of table seating -- but who cares about that when you want to eat alone? It's not too dark, there are lots of TVs, the music is a mystifying mix of Vampire Weekend, Beyonce and 80s, the servers range from charmingly social to semi-efficiently disinterested (which I'm ok with), the food is decent -- I like the salads and the flatbreads but have heard mixed things about everything else -- and the drinks are interesting. Basically, it's the perfect combination of safe and anonymous, with the added benefit of a competent kitchen. \n\nThe cocktails tend to be on the sweet side and for some reason the person who designed the menu decided to name both a drink and a salad the Menlo Park, which makes for some confusion and seems like a ridiculous oversight. \n\nPricing is reasonable: many menu items are under $10.00. The cocktails are also reasonable but, given the sweetness, not really worth it. Or maybe they are. It depends what you like.\n\nBasically, this is a place I go by myself. Maybe I'd go with friends. And I'd definitely go with a blind date.","To be perfectly (and embarrassingly) honest, I started going to Industry specifically because I conduct information technology integrity would not check anyone that one tool there. Sometimes you severe really don't privation a put where anybody knows your name. Sometimes you deficiency to price antiophthalmic ingredient girl, only at a bar, drinking amp bourbon and record A book. And diligence shot the observance perfectly. It's angstrom unit better-looking blank put with A titan bar domain and smoke of card invest -- but who caution some that when you want to waste alone? It's not to a mistake dark, inward that respect be distribute of TVs, the medication exist amp deep merge of vampire Weekend, Beyonce and 80s, the server kitchen stray from charmingly mixer to semi-efficiently disinterested (which I'm very well with), the substantial food for thought be becoming -- I same the salad and the flatbread plainly sustain heard merge involvement approximately everything else -- and the drinks argon interesting. Basically, it's the gross intensify of sentry go and anonymous, with the result profits of deoxyadenosine monophosphate competent kitchen. \n\nThe cocktail constitute pay to be on the sweet-smelling position of sum and for round confinement the individual who intentional the exile see to epithet both A beverage and A salad the Menlo Park, which fake for virtually confusion and appear likewise a nonsense oversight. \n\nPricing live reasonable: many bank note of bill of fare item cost under $10.00. The cocktail epithet ampere skilful sane but, fruit the sweetness, non rattling worth it. work elbow room possibly they are. information applied science nix what you like.\n\nBasically, this monetary value deoxyadenosine monophosphate lay iodin endure aside myself. mayhap I'd XTC with friends. And I'd decidedly disco biscuit with deoxyadenosine monophosphate unreasoning date.",1,0,True,2046
"I was visiting my house here in Surprise this week from Washington, DC.  Found this place on Yelp, and I am very impressed with the service and especially the pizza.  I have been looking for a great place to go that was near my house and this is the place.",Failed to initialize,1,,False,976
"Do not rent a Jeep Wrangler from this location.  We brought ours back with the top down, and they rude lot attendant told me if I didn't put it up I would be charged $75.  I didn't have time to put it up, and it wasn't my job anyway -- I AM THE CUSTOMER!\n\nWell, those jerks did charge my credit card.  However, I reported them for fraud and got my money back.  Suck it Fox!\n\nPlus I agree with what everyone else said about this place.  It is an ordeal getting back to the airport!","Do not rent a Jeep sawhorse cavalry cavalry horse wrangler from this location. We brought ours bear with the clear down, and they fossil petroleum tidy heart and soul accompanying differentiate yen tree tree posit if atomic number 53 didn't draw up selection info engineering skill improving i would consist out dollar $75. ace didn't birth quarter dimension to set it up, and information technology wasn't my farm out anyway -- iodin Artium Magister THE CUSTOMER!\n\nWell, those bear on play Pearl Buck my recognition card. However, atomic come 53 squeeze them for humbug and begin my money back. imbibe info mastermind Fox!\n\nPlus ace go with what everyone else articulated near this place. It live Associate in Nursing trial by ordeal bring forth gage to the airport!",0,1,True,799
"Saw them for the first time when they were at Monte Carlo and this is my second time seeing them for their Prism show in Luxor. Both times their performances were amazing. I like that they incorporate some story/plot to the show rather than just random dances. They are very creative. I also like that there is some humor to the show and that there is audience interaction. One tip though is to try to get seats in the middle row probably middle ways from the stage. Me and my brother were on the second row from the front on the left side and though we could see up close we couldn't always see what was happening on the right side. Plus, the speakers were very loud. Overall a very good show that I would see again.",Failed to initialize,1,,False,958
This company delivers incredible service again! I highly recommend them for your home's plumbing needs.,This company crotch terminated improbable service again! i extremely itching them for your home's plumbing system system needs.,1,0,True,171
"I love mexican food and I would want mexican food for lunch everyday if I can.  \nNow you can guess how excited I was when I found out that I had mexican restaurant right next where I work.  \n\nBut sadly enough this Macayo's mexican kitchen was not a real mexican restaurant.\nThey make McDonald version of Mexican food. \nI can tell that they use low quality meat, chiken etc. \nI am so sad that have to drive at least 5 minutes to get real mexican food.",Failed to initialize,0,,False,902
"I've been coming to this restaurant since 2008- I can say I've never had a bad experience or meal. The food has always been consistently delicious, warm, and savory. My nana was Cuban and the food here brings it pretty close to her home cooked meals. The service has always been friendly and the restaurant well kept with a very inviting decor. I've recommended and brought many friends and relatives here and they have all agreed that compared to Versailles or other Cuban restaurants we have been too this is by far the Best. \n\nEven my Cuban friends have loved the experience and food here. Today I was back in Vegas and as is usual for me I went in for lunch with a friend who had never had Cuban food. She LOVED IT! The croquetas were delicious, as was my Picadillo (as usual) and the Salmon was exquisite. \n\nWhen we finished our meal we asked we could we go to catch a cab back to the Treasure Island, the waitress offered to call for one. After waiting no more than 5 minutes the owner Sergio- came out to try to flag one down. Since no one was stopping he then went back into the restaurant, grabbed his keys and told us: \""""follow me ladies I will drive you.\"""" NOW THAT'S CUSTOMER SERVICE! \n\nThank you Sergio for your kindly driving us back to our hotel. We will definitely remain loyal patrons of your restaurant! Love, Angelica & DeeDee",Failed to initialize,1,,False,950
"Terrible!  I chose this office because it was close to my work and took my insurance.  After waiting for over an hour past my appointment time, Dr. Blanchard spent 45 seconds in the examining room.  When I asked him to hold on because I had a couple of questions, he completely brushed me off.  Instead of making an appointment to come back, I said no thanks.  I know of several dermatologists in this town who are very caring and plan on making an appointment there even if it means a drive across town.  Will not be back here!",Failed to initialize,0,,False,959
"If I could give this place no stars, I would. Worst manicure I've ever had. They upcharged my 13 year old sister kid sister without first alerting one of us the change in pricing. Total rip off, rude service, not even worth going back to get my nails fixed.",Failed to initialize,0,,False,935
"Went in with my son for a coffee and quick bite at around 9:30am. The cashier forgot that we had ordered a hot sandwich and I had to remind her to get it started. It wasn't busy at all, we were the only people in line! I don't think she said two words to us while taking our order. I basically could have used one of those iPad ordering tablets like Panera is using for all the good the cashier did. Totally not helpful!! I ordered a danish and a croissant which she did not offer to warm up, she did not ask my name for the order or even look at us while we were ordering. Basically a super bad experience compared to other Starbucks in Charlotte.",Failed to initialize,0,,False,973
"I got the exotice fruit crepe which was good.  It came with a scoop of coconut gelato.  I thought the geleto taste better than the crepe.  Its about $15 for a crepe here, which I thought was a lil pricey.  I think the next time, I'll just go to Paris hotel for crepes.  But the gelato here was great.  The coconut gelato had lil bit of coconut pieces in it and it was sooo creamy.",Failed to initialize,1,,False,892
Delicous. Love the lunch specials. Delivery takes a little while but picking up or eating in isn't to long of a wait. Service is good. My main thing is their lunch specials. Cheap and quick,Failed to initialize,1,,False,925
"Second time here after a day of golfing. Food is okay, prices okay. Major complaint is service. This is a pub, and it took 20 minutes before someone came to our table and asked if we wanted some drinks. It happened.both times. The place was 75% full, not over packed. Service was so slow and hard to get, i don\""""'t think i would come here again.",Failed to initialize,0,,False,921
"La Mexicana is an upgraded version of the street vendors.  Good healthy food, prepared home style, this is the real deal.  \n\nThere is nothing pretentious about La Mexicana, including owner Roberto who sports a soul patch and perfect English.  The walls are decorated with memorabilia and the tables are large, solid and sturdy.  \n\nWhat makes La Mexicana worth the trip is the food.  It's made fresh daily in the small kitchen.  There are 3 kinds of chili (what we gringos call salsa) 2 red and 1 verde each with a distinct flavor.  \n\nThe carne asada is is grilled, thinly cut and goes well in the ample burritos filled with rice, beans and fresh cilantro.  \n\nThe chili verde, chucks of pork in a nice tasty brown sauce are equally at home as a stand alone dish over rice with beans and salad on the side or stuffed into a burrito, enchilada or taco.  \n\nLa Mex is about as authentic as it gets.  A working persons cafe, it is always filled with locals on a break from work, holding meetings or watching the huge TV that dominates the corner playing \""""futbol' or Telenovelas or the latest musical offerings live from Mexico City. \n\nLa Mexican is a Vegas local's hidden treasure.",Failed to initialize,1,,False,886
"This place was very \""""eh\"""" I got the mushroom burger, it was big but flavorless. The flavor of the sauce on the wings was quite bazaar in my opinion and the tarragon on the fries was extremely overpowering. But to top it all off the service was really below average. I was very disappointed in my dining experience here and for the price point there are much better burgers out there.",Failed to initialize,0,,False,973
"Wow love the place and everything is very clean and new!\n\nGreat place to come and relax worth a try!\n\nCheers,\n\nEric Van Nguyen\nVisited April 2012",N/A,1,2,Skipped,0
"-I ordered a whole milk latte.-\n\nNew Lux is what some argue is a 3rd wave coffee shop. That's code for \""""we are a restaurant that serves coffee\"""". And it shows, just as it has in every shop I've been to that tried it.\n\nCoffee: \nThe roasting method is half science and half magic. It's like the creationism of roasting. You stop roasting when it feels right. This causes quite a bit of variation from one visit to another.\n\nBaristas:\nThe staff here are as cool as any of your friendly neighborhood hipsters. They usually remember my name and they do enough volume in a shift to get good and practiced making latte art. \nThe grind is pre-ground which oxidizes the coffee before it is brewed.\nThe tamp appears to vary by the body weight of the barista.\nThe pull seems weird with a bunch of gauges that seem placed there for show as none of the staff seem to pay any attention to the contraption. \nMilk steaming here is near perfection, with fancy pants latte art and proper cappuccinos. \n\nTasting:\nThe temperature of the coffee is perfect, as this is a component mainly of milk steaming skills.\nThe pull today however, was far to the bitter side making my latte taste more like an IPA than a sweetly balanced coffee.\nThe staff is more than friendly and when the drinks are delivered they call out your name and drink. It's presented in proper china and with efficient but respectful flair. \n\nShop: \nI love people watching here, somehow this is the go to place for scenesters and the beautiful people of Phoenix. It's like that club you go to that only lets models in. \nNew Lux suffers from some of the same problems as Old Lux; seating is akin to taking up residence in a sardine can (but there is a lot more of it now!). The baristas are either hard of hearing or just prefer that no one can talk over the music, I usually just put my headphones in as earplugs so I can think.\nTheir internet is still free and is vastly superior to the wifi they had at the old Lux. \nThe drink prices are fair and what you'd expect at any specialty coffee shop, the pastries can get a little expensive. Credit cards are welcomed and the loyalty card gets every 11th coffee for free.\n\nJeff is much more focused on the bar at this public house, which I'd recommend Lux for far more than for coffee.",N/A,1,2,Skipped,0
"I got a good deal on a Groupon for the new Quaker Steak & Lube so we stopped in for a late lunch last week.  There were only a few patrons in the restaurant at that time.  It was so slow, in fact, that it seemed that we were a bother to the hostess because she really couldn't seem less interested in seating us.  Thankfully, our server made up for her shortcomings, plus some.  He was fantastic.  Very attentive and very personable.\n\nIf only the food was as good as the service.  Ugh...such a let down!  I ordered Mild Wings.  The sauce was ok, but the skin was too soft.  My son got the Medium spiced wings and he said that they were ok, but that he's had better.  My husband ordered the Philly Cheesesteak and said it was acceptable.  Nothing special, but not terrible either.  He also got a small order of Cajun spiced boneless wings.  I tried them and the flavor was NOT appealing to me at all.  The one saving grace for the entire meal were the onion rings.  A tad too salty, but perfectly crispy and not greasy.  My son and I liked them very much.\n\nThe decor is a bit gaudy, but I'm fairly certain that's by design.  I'm glad that we were seated at a booth because the plastic lawn chairs at the standard tables would have been very uncomfortable.  The only downside to the booth was that I was a bit grossed out by how filthy the framed picture was that was hanging over our booth.  It looked like some kids smeared their dirty hands all over the picture.  Seriously, it was disgusting and it even had an odor.  And speaking of odors...there was an odor in the restaurant that reminded of me the remnants of water damage.  It was really off-putting.\n\nSo...it wasn't a good lunch at all and we won't be back.  It's a shame because the concept of the restaurant is cool and the menu \""""looked\"""" great.",Failed to initialize,0,,False,948
"This place should be ashamed of itself.  When it was the Red White And Blue, we liked it, people were nice, food decent.  This place is what I would have to call \""""abusive\"""".  Abuses your wallet, abuses your body.  The other restaurants at Mandalay are ok, this one is NOT.  Since Vegas has cleverly crafted itself for the new economy I suspect Citizens is top of its class.  They know people need breakfast and lunch, and this is the ONLY reason the place has customers.  Their profits come from over charging for low quality food to a crowd that has no where else to go.\n\nTo sum it up:\n\n- Grossly overpriced.\n- Hash browns = tater tots smashed into a mash.  Good job chef, your the best !\n- Overall food quality low.\n- Your treated like cattle.\n\nWill never return.  Drive to whole foods and stock up if you need a quickie snack or brunch during the day.",Failed to initialize,0,,False,928
"Our worst meal experience ever.  The waitress couldn't get our order right to save her life, our drink order!  We ordered two lemonades, she drops off two ice waters, so we assume the lemonade is coming.  She comes back by a few times so we finally ask if they're coming, oh you wanted Lemonade?  How many?  I say two and hold up two fingers.  She comes back with one.  Okay fine, we'll share.  The appetizer wasn't very good or hot.  Then our food came, the buffalo chicken sandwich tasted good.  Then I take a bite of my mashed potatoes and they were ice cold in the center, like they had thawed out a frozen mound of potatoes.  We had to get up and leave, enough was enough!",Failed to initialize,0,,False,923
