original,adversarial,original_label,final_label,success,queries
"The Regent Square Theater...a great place to go for film lovers.  \n\nI have all but stopped going to 'the movies' because of the general societal behavior at the cineplexes.  I am a film geek all the way, and when I go to see something on a big screen I am seriously going to see a 'film' that is art presented as it is intended to be seen...large.  I do not go to a cinema for the social aspect, or to kill time with a date, or to just get out for an evening, with what's showing on the screen being secondary to the purpose of the evening.  \n\nWhen I go to see a film, I do NOT go to listen to the conversations of others, the bleeping of the cell phones, the clicking of mindless text messaging or silly giggling that comes from someone's interaction that has nothing to do with what's on the screen.\n\nThis is where the Regent Square Theater wins.  This is a cinema for serious film lovers. You may not find a HUGE audience, but what you will find is an audience of people who know how to behave in a cinema, who are there for the same purpose...to see a good film on a big screen.  The audience at the Regent Square theater know directors, and they might actually be able to hold a conversation about the director, his or her films, other similar films and directors, and they know to wait to do it when the film has ended.  \n\nThe Regent Square is a very comfortable old-style small theater.  One screen. Small reasonably friendly staff, affordable prices (although the last night I went the popcorn, which was cheap, was also a tad stale) and most importantly...a venue for excellent films.  Foreign, indie, documentary...and some classics thrown in regularly to enable us to see some of those old gems on a big screen, where most of them were meant to be.  I never realized how important that big screen was until I'd seen The Wizard Of Oz, after years of mini-televised viewings with chopped and hacked commercial interruptions, on a big screen at a special showing somewhere else. One who doesn't watch these things on a big screen doesn't know what they're missing by not seeing the full large scope of the intended art.  \n\nSome (in this era, I can't claim 'many') directors truly do use the big screen when creating their art. Jeunet, Almodovar, and a few others still do present film as art, and the Regent Square (and Pittsburgh Filmmakers who operates it) bring these gems to that big screen.\n\nAnd to a film aficionado, the right atmosphere is crucial when getting lost in this art. The Regent Square Theater knows this, and so do its audiences.\n\nThank you for providing an intellectual oasis in da burgh...and a great evening of cinema enjoyment.",Failed to initialize,1,,False,943
It was great. I highly recommend it. Especially garlic butter and filet mignon are perfect.,Failed to initialize,1,,False,890
"Had a quick lunch yesterday and was pleasantly surprised by how good the cantina fish taco's were, they were tiny (which is how I like to eat) and full of flavor. Good service and nice atmosphere. Will definitely be returning for lunch more often.",Failed to initialize,1,,False,932
Not a very good selection. Had to wait for food to come out. Lots of fried options. Wanted to like it. Just didn't sit well. Sounds like timing at this place is crucial.,Failed to initialize,0,,False,907
"I used to live across the way so i ate there a lot.  I'm basing my review on the fact its mixed of all the times I've eaten there... I only had one meal which was very lemony and very salty and ... it was during happy hour, and the waitress brought new and also didn't charge me.  \nGET THE ROASTED VEGETABLES.  AMAZING.  I beg for the dressing recipe everytime I go.  They also have a salad with corn in it which will last for three days its so big.  \nmy girlfriend gets salmon everytime and says its the best in the valley.  Shes well traveled.\nLOVE THIS PLACE, it gets hoppin on fridays and especially on first friday.",Failed to initialize,1,,False,888
"Went to Vegas for my birthday weekend planning to have a nice trip with family and friends. Everything was great up until this buffet. We went on Saturday for some breakfast which was okay. That experience gets four stars for great service and decent tasting breakfast foods. Today, Sunday, was an ebtirely different story. Wanted to top the weekend off with an awesome Luau themed buffet recommended by the awesome staff from yesterday only to be majorly disappointed. Excited, we waited in a two and a half hour line which was totally no big based on Saturday's great service and the awesome Hawaiian dishes we were about to experience. Then we get to the cashier who cashes out the first half of our party of five but snubs the second half without a basic \""""one moment please\"""" just turns around and processes someone else through (she knew we were a part of the same party, no excuses for a bad attitude and crap customer service). Hostess who sat us was wonderful all smiles. The second host who sat us was less than accompdating. As she was setting silverware I attempted to ask her about the champagne service for brunch because we were craving a couple of mimosas and knew the service would end soon. She blatantly ignored me to scurry off somewhere else. My friend caught her again after a few minutes and she merely told us the sever we had been waiting for to take our drinks would be right with us before scurrying away without waiting for a response. Which she probably knew would have been that our waiter hadn't come by our table in the twenty minutes we had been sitting there. Finally we catch a hold of a random guy serving a nearby table, Steve, and he's great totally takes our orders and even though its his first day he's doing a splendid job. Unfortunately, we are unable to get our mimosas because they stopped serving the champagne after 3:30. Twenty minutes after we were sat and ten minutes after we finally found a waiter to take our drink order. Normally, the sucky service would have just been shrugged off. But being told we didn't make it for the champagne when we did and had waited in a two and a half hour line partly for that service. Was going to leave only one star but Steve's awesomeness gets its own star. Conclusion: pretty good food but sh*t customer service on Sunday brunch days. Don't wait in line expecting the food to make up for bad customer service. Not worth the $20 to get in or the $13 with the players card. Would not come back here and will definitely not recommend it.",Failed to initialize,0,,False,957
"You can order at BLT and have it delivered to the outdoor patio. Good food, great people watching and lovely Las Vegas weather - doesn't get much better. \nWide variety of both burgers and fries well prepared.",Failed to initialize,1,,False,923
TruCom is great when they/it works.  We have them for internet service and when it goes out - if it's late Friday evening - don't count on it working again until Monday.  The only provider I know that lets their customers sit without internet service for days on end.  RIDICULOUS!!!,N/A,1,2,Skipped,0
"The drawing card for the Circus Circus Buffet used to be  $4.99 breakfast, $5.99 lunch and  a $6.99 or $7.99 dinner.\nI took a group to Las Vegas and thought it would be a good CHEAP place for lunch.\nI was amazed to find out the lunch was now  $10.99 ......\n\nThere is no way this buffet is worth that......\nI know you are saying that it is 1/3 the cost of other casino/hotel buffets.\nYes it is , but the quality is nowhere near one third of the other hotels.\n\nA major disappointment ...... \nvery, very average buffet fare at best.\n\nWe were lucky that there was no line ....\n( perhaps that should have been our clue )\n\nShould they get two stars because they are inexpensive .....\nI think not.",Failed to initialize,0,,False,941
"I had heard about this place for years but never went. Tragic I know! Just recently I discovered that it was literally walking distance from Jester'Z Improv where I work. Oh, how i must now make up for lost time!\n\nPop the Soda Shop is a true place of brilliants. They have a fantastic selection and a very knowledgeable staff. When you come to pops that is what you are looking for, product. And they have the best selection in town. \n\nA couple of recommendations. Doctor Eli's Blueberry, Jackson Hole Huckelberry, or really any thing in the Birch Beer section!",Failed to initialize,1,,False,913
"if you are cool with losing your deposit when you move out... this is the place for you!\n\nWe bought a house and surrendered the apartment 3 weeks early (paid for) and in spotless condition.  The manager said everything was fine in the walk-through.  Then, we get a letter stating that they were deducting over $300 in cleaning and damages.  Yet, the manager had said everything was fine.\n\nRediculous charges and horrible excuses for customer service.  Do yourself a favor and find a complex that hires people with a little class.",Failed to initialize,0,,False,930
"I'm sorry but the employees at this location are RUDE. I asked for help and they were upset because I interrupted their personal conversation. They want you to spend all your money. I asked if they had any deals and they rudely said \""""No\"""" but then when I went to go pay for my stuff one of the workers allowed the customer who was  checking out next to me use multiple coupons. I bought an outfit for my Daughter while she was at school not knowing if she was going to like it or not and she ended up seeing something at a different store for half the price, so I went back the next day to get my money back (the male at the counter said I had 30 days to get a full refund with receipt) and when I went back the girl at the counter said she was only going to give me store credit. I said \""""I don't need store credit, there is nothing here that I want to buy and the guy told me I can get my money back before 30 days\"""" She was very upset, started slamming things around, was very rude and she ended up getting so frustrated that she made another girl finish the transaction and she went to help another customer. I love Childrens Place but I will NEVER again return to this location!",Failed to initialize,0,,False,971
"Brokenhearted: This used to be my FAV restaurant in Steele Creek Area! Not sure, but maybe new management has set in these past two months. I've been four times in the past month. (in keeping with the FAV part). Brunch: 3 weeks ago and had to be comped a wine because they were OUT of two they supposedly had, food was LONG wait and just meh. AND they had no manager working... everyone running around, with a guy from the kitchen waiting tables. Dinner: this was pretty good, food good. (Hope was renewed). Lunches: two... 45 minutes for SALAD. SALAD. no apologies, one size for the soup (noticed too late the new menu), so $16 later for soup/salad that took over an hour to order, get, eat (rushing to eat)... I'd say I've got to be done here. It's very sad. MISMANAGEMENT.... not sure if new manager or new owners. But, I will try and go over to Hickory Tavern before going here next time\n.",Failed to initialize,0,,False,884
"Sprawling tired resort with $30 a day resort fee and lots of tipping opportunities. The resort fee was supposed to be waived for those attending the event, and was with restrictions like we couldn't use the fitness center. Only stayed here because the conference was here. We told the front desk that we were there for the conference, and wanted to be with the other Realtors, and instead they put us in a Mountainside Villa that was a hike to get to the event.",Failed to initialize,0,,False,963
"Usually Have a great experience but the last time was awful! The host was very rude and our server Jeffrey was slow and sarcastic (in a bad way) the food is always great, but over all dealing with the staff was not worth it!",Failed to initialize,0,,False,973
"We've been going to the Texas Land & Cattle since it opened in Concord and never had a problem.  Now they replaced a very well designed menu with one that's horrible. It took awhile to figure exactly how to order.  My wife couldn't eat the crab cakes, they looked and tasted like something that came out of a microwave.  The manager and waitress were both very nice about the whole ordeal, but we won't be going back.  Too many other choices in our area.",Failed to initialize,0,,False,945
"speechless...this store & their product is the best ever.  after reading others' reviews this is just another proclamation of how great your experience could be visiting this store as well as going home happy w/ the product.  first of all, i didn't know about the facial deal that the vegas location had.  something to look into during my next visit.  \nmy sister & i stumbled upon this store hoping to take a short cut back to our hotel room but we had at least a 1 hr detour.  victoria offered a 10 min facial since they didn't have any samples of their creme ancienne.  i was experiencing extremely dry skin & flaking because of the weather, the water, and being in the air conditioned rooms hotel/casino/meetings for 4 days.  victoria started from the first step, face wash to even trying out some of their make up line.  i walked out w/ an abundance of things, and i'm so happy with all my purchases.  no regrets.  my faves so far is the seawater toner, ancienne, twilight primer, supernova mascara, face luster w/ brush, lip gloss, hand cream, acai body cream - ok everything!  \nthey typically have good samples but they ran out - go figure.  \ni want more, i'm addicted!  i hope the sf fresh location gives me just as great service.",Failed to initialize,1,,False,905
"I know this venue is wayyyy too small but I think when they first built it, they had no idea it would reach this level of capacity. I mean literally you cannot reach the dancefloor, its impossible. Its so small.  Tao cant handle the ppl and now they are getting horrible reviews for it. Ppl still come here tho cuz this is where the crowd is at. Very mixed crowd, great service, free drinks for girls for an hour. Honestly there seem to be more girls then guys here, which of course pisses me off lol.  Come here and you will definitely hook up with somebody haha. If they open the beach during the warmer seasons, it wont be as packed on the main levels cuz ppl can go upstairs and chill. Dont pay cover, get on glist. I got kicked out once for being overly intoxicated but even so I always enjoy going to this club:) one more thing, tao pls upgrade! Its time to expand.","I know this venue is wayyyy too small but I think when they first built it, they had no idea it would reach this level of capacity. I mean literally you cannot reach the dancefloor, its impossible. Its so small. Tao cant handle the ppl and now they are getting horrible reviews for it. Ppl nevertheless extinct and indeed entire here tho cuz this produce where the crew together constitute at. very mixed crowd, anticipant service, disembarrass drinking for untested scavenge cleaning woman for Associate in Nursing hour. frankly at that property look to constitute more girlfriend then roast here, which of of course pisses me strike down lol. come Here and you leave decidedly hint upwards with somebody haha. If they uncontaminating the beach during the warm seasons, information engineering substance abuse represent A pile on the conduct dismantle cuz ppl take a crap human activity on a higher floor and chill. Dont wage cover, produce along glist. i set prohibited evident criticize prohibited once for constitute excessively uplift solitary even out therefore iodine invariably taste sensation proceed to this club:) matchless to a greater extent than thing, tao pls upgrade! Its time to expand.",1,0,True,1131
"Fantastic!  Food was great and unique.  Scotty was attentive, humorous and knowledgeable.  I would recommend multiple visits because everything we tried was great.  We actually went two nights in a row.",Failed to initialize,1,,False,893
"I spend quite a bit of time gallivanting through the entire valley since my relocation to the desert so I've been on a one woman quest to find an affordable and pleasant nail experience. My pedicure here was very nice with a massage, hot stone, vibrating massage (er, once I got over that bit of awkwardness as the massage wand was a bit unexpected). The results were pretty, but not earth shattering. \n\nHowever, my manicure was one of the worst ones I have ever received. Even without touching anything and sitting patiently for my nails to dry (as they do not have the snazzy light bar to quick dry), my manicure is all bubbly and splotchy. I am not skilled with the nail art at all, but I could have done better myself at home. My nails were also filed and buffed over my pants, so my jeans looked worse for the wear after the whole experience. For $35 for a manicure and pedicure, I expect more.","I spend quite a bit of time gallivanting through the entire valley since my relocation to the desert so I've been on a one woman quest to find an affordable and pleasant nail experience. My pedicure here was very nice with a massage, hot stone, vibrating massage (er, once I got over that bit of awkwardness as the massage wand was a bit unexpected). The results were pretty, but not earth shattering. \n\nHowever, my manicure was one of the big unity I have ever received. Even without touching anything and sitting patiently for my nails to dry (as they do not have the snazzy light bar to quick dry), my manicure is all bubbly and splotchy. I am not skilled with the nail art at all, but I could have done better myself at home. My nails were also filed and buffed over my pants, so my jeans looked worse for the wear after the whole experience. For $35 for a manicure and pedicure, I expect more.",0,1,True,744
"Good food and good service.  Their pasta dishes really excell.   On our last visit, we so enjoyed the Chicken Caesar Flatbread appetizer (we polished it off in no time!) and the warm Chocolate-Caramel-Banana Panini was over the top!  That, you have to try!\n\nAudrey A.",Failed to initialize,1,,False,896
Midori really is as good as it gets.  You'll find no better source of fresh and beautifully prepared sushi...all at a great value.  Every time I try another sushi restaurant I end up thinking that I wish I'd gone to Midori.  Truly great service too.  Highly recommend!,Failed to initialize,1,,False,913
"Great food, fast service and awesome margaritas on the patio made for a great lunch!","expectant food, fast service and awful margaritas on the patio made for a great lunch!",1,0,True,96
"Okay, a friend came back to the burgh for a long weekend and after much pleading, begging, and finally, paying me off to take her to this popular Pittsburgh heart clogging, frat boy hangout. If you've had one, you've had every sandwich they sell. They all taste the same, maybe if they salted the fries? Anyway I guess I outgrew the taste of these grease balls. A cold Sam Adams was sitting in front of me and suddenly I thought of it, I can eat healthy by getting turkey, no cheese, fries, or mayo. The waiter looked perplexed after asking him if I could just have turkey with onion, slaw, and tomato. Didn't matter, my sandwich came with fries anyway, guess you can't teach an old dog new tricks. I picked the fries off and gave them to my friend, who by the way does not take Zocor. As I stated before in a quick note, this original Primanti's is basically a tourist trap, Oakland college getaway, and food network geek paradise. I'll go to the primanti full service restaurant on the other side of Crafton where they cook a bit healthier and offer lighter fare.","Okay, a friend came back to the burgh for a long weekend and after much pleading, begging, and finally, paying me off to take her to this popular Pittsburgh heart clogging, frat boy hangout. If you've had one, you've had every sandwich they sell. They all taste the same, maybe if they salted the fries? Anyway I guess I outgrew the taste of these grease balls. A cold Sam Adams was sitting in front of me and suddenly I thought of it, I can eat healthy by getting turkey, no cheese, fries, or mayo. The waiter looked perplexed after asking him if I could just have turkey with onion, slaw, and tomato. Didn't matter, my sandwich came with fries anyway, guess you can't teach an old dog new tricks. I picked the fries off and gave them to my friend, who by the way does not take Zocor. As I stated before in a quick note, this original Primanti's is basically a tourist trap, Oakland college getaway, and food network off-the-wall paradise. I'll go to the primanti full service restaurant on the other side of Crafton where they cook a bit healthier and offer lighter fare.",0,1,True,36
"Unfortunately, my experience was much similar to Mark's. The staff was indeed friendly, but entirely unequipped to provide proper attention to a patient's individual needs. My therapist, Melissa, was nice, but after the initial assessment she failed to explain in any detail the source of my pain, where it might have come from or illustrate a course of action. Instead, I was handed a sheet of exercises that looked like I could have printed it off of Google.\n\nMelissa often had more than one patient scheduled during our appointments. I would arrive, and she would have me work on a machine while she saw to someone else. On multiple occasions I would spend entire minutes sitting, motionless, waiting for Melissa to come back and instruct me. This is \""""treatment\"""" - time that I was billed for! This did not seem to be the case with Melissa alone, either. At almost all times there were at least six patients for a total of two or three therapists. One morning a woman even brought her labrador into the treatment room and it proceeded to bound around, off-leash, for her entire session. I'm a dog lover as much as the next person, but it's bad enough I have to share precious time with other members of the same species, much less a dog!\n\nUltimately, I received no relief, no specialized attention and no care. I stopped treatment after three visits and would not recommend this clinic. In addition, as Mark said, be sure to read the \""""Welcome\"""" form - it will inform you what your insurance deductible is and how much has been met. Under my plan, previous chiropractic and physical therapy treatments had not been subject to a deductible, but my benefits had recently changed. I was shocked to get a bill in the mail for $570! That is an outrageous amount to pay for such poor care: patients need to be informed of what mediocre medical treatment will cost them. \n\nI will add that, after expressing my dissatisfaction to the Patient Services manager, she was quick to respond and offer a resolution that I thought was fair. As stated before, the entire staff is courteous and patient, but I would caution that it may be worth your time to seek treatment elsewhere.",Failed to initialize,0,,False,929
"Cannot believe this place is still in business. Went in for catlitter. Had been at whole foods next door and am new to the area so I wandered into what appeared to be a nice store, which it is. However, went into shock when I saw the prices. Thought it was a joke at first.  Box of litter I get at Walmart, safeway, etc is Arm &Hammer Superclump.  This place charges $47 for what should be $13.98...When I asked the staff if these prices were for real, she immediately tells me she will honor a matching price. Guess she is used to hearing this. I should have walked out but it was late and I didnt feel like going into another store. Then it took the staff person almost 15 min to figure out how to ring me up at the lower price. I did appreciate her efforts but this store should be avoided unless you have money to burn...never thought I would encounter such price gouging over a basic pet product.",Failed to initialize,0,,False,959
"For the price, this is a great option. \n\nClean, comfortable, modern, awesome location and fantastic guest services. Free wifi, decent gym. \n\nI really love the outdoor fire pit & the menu at the restaurant has an outstanding selection. \n\n**Warning!! A huge disappointment!! While traveling for business, where my sleep is imperative, I was quickly disturbed with the obnoxious volume and thumps coming from the adjacent night clubs. This was on a was even on a Tuesday night!! I can only imagine a weekend noise level! So intrusive. So upsetting. Can't stay here again because of this ;(",Failed to initialize,0,,False,894
Yet another horrible experience. 7 grain bread was soggy and undercooked. A few weeks ago the tuna was missing from the sandwich. And it's only this location.,Failed to initialize,0,,False,916
"Paciugo has CLOSED!\n\nA new gelato place has taken over this location though - La Coppa.  A friend and I ate there this past weekend and they were very good - just need to expand their variety of flavors to some that a little more inventive, as Paciugo did.","Paciugo has CLOSED!\n\nA new gelato place has taken over this location though - La Coppa. A friend and I ate there this past weekend and they were existing good - just need to expand their variety of flavors to some that a little more inventive, as Paciugo did.",1,0,True,36
Slowest service in the world. Never going back. The food was respectable but it was not even close to the amount of time that we wasted there. \n\nDo not go here because it is genuinely not worth it.,Failed to initialize,0,,False,963
