original,adversarial,original_label,final_label,success,queries
"Nightclub rating only...\n\nWe got lucky because we happened to arrive during Kris Humphries' (new husband of Kim Kardashian) bachelor party.\n\nI also saw Jordan Farmar, Lamar Odom and Scott.\n\nPlace was packed on a Saturday night and we didn't want to wait in line so we did bottle service. Cost us $575 total for 5 guys and we got grey goose and our choose of drinks.\n\nYou don't get your own VIP booth - you actually get to sit on a long couch and you get a small section along with the other bottle service people.\n\nOverall pretty cool club, but I think it's pretty small compared to others like XS, Marquee, JET, and Pure.","Nightclub rating only...\n\nWe got lucky because we happened to arrive during Kris Humphries' (new husband of Kim Kardashian) bachelor party.\n\nI also saw Jordan Farmar, Lamar Odom and Scott.\n\nPlace was packed on a Saturday night and we didn't want to wait in line so we did bottle service. Cost us $575 total for 5 guys and we got grey goose and our choose of drinks.\n\nYou don't get your own VIP booth - you actually get to sit on a long couch and you get a small section along with the other bottle service people.\n\nOverall pretty cool club, but I think it's pretty small-scale compared to others like XS, Marquee, JET, and Pure.",1,0,True,45
"Absolutely atrocious service, while there were only three tables of customers at 7pm on a Saturday night.  To top it off, the waiter was a smart ass when, after 15 minutes of his being MIA, we inquired as to his whereabouts when we wished to order more drinks & food.  On the plus side, the food was fine and arrived quickly (even before the chips and salsa appetizer?).","perfectly serious service, while there were only three tables of customers at 7pm on a Saturday night. To top it off, the waiter was a smart ass when, after 15 minutes of his being MIA, we inquired as to his whereabouts when we wished to order more drinks & food. On the plus side, the food was fine and arrived quickly (even before the chips and salsa appetizer?).",0,1,True,225
"Worst customer service ever.  While some things that went wrong were out of their control, this so called \""""business\"""" was completely unprepared.  It was obvious you were trying to increase your margins by cutting corners to cut costs across the board.  1ns did not tender the service which everyone paid for.  Johnathan's excuse for basically making eveyone's weekend uncomfortable and unstable, \""""It's our first time doing this.\"""" This business is a joke.  Not only that, when we get on the bus for the trip back to LA, eveyone was offered a $50 refund for transportation.  Then when he found out they got a charter bus, he took the paper back and said nevermind...WTF is that? If anything I should be refunded for the multiple nights I had to pay to get back from EDC. your ONE yellow shuttle was no where to be found.  Everyone also basically lost their whole friday because the shitty fucking bus broke down. Also was made to look like a fool when I go to TAO Beach when it opens only to be told they've never heard of 1nsgroup.  They might have been fixed after, but it was still embarrassing.  SO MANY OTHER THINGS that I haven't mentioned.  Please fellow people who went through hell because of 1ns, add whatever I forgot below.  I plan to report them to the according consumer bureaus.",Failed to initialize,0,,False,941
"L.A. people are so spoiled with wonderful sushi restaurants at nearly every corner - I'm one of those people. But I have to say that Roka Akor has blown most of the L.A. sushi restaurants I've been to out of the water. I don't always rate the restaurants I eat at for various reasons, but I couldn't wait to rate this restaurant. You'll see why...read on please.\n\nRoka Akor is rated as one of the Top 10 sushi restaurants in the U.S. by Bon Appetit, so with that rating plus being from L.A., we were definitely expecting a lot. We were welcomed warmly, seated promptly at the best seat at the sushi bar, and given our menus. We took a gander, and were kind of shocked at the minimal selection of rolls on their menu. (Of course this didn't matter later once we tasted their food - everything is excellent. Don't let this disappoint you, it's excellent food.) A few minutes later, I noticed another couple seated a few seats away from us. Their waitress attended to them right away, and we still hadn't been attended to at that point, so I was immediately pissed off and ready to walk out of the restaurant. My friends who know me well, know that this action would have been true to form. I'm nice, but I'm accustomed to excellent service at all types of establishments. When I don't get it, I get pissed off - that's just who I am and I don't think I'm the only one.\n\nI digress...\n\nI'm glad my husband kept me seated to give the waiter a chance to come over and take our order because I ended up really enjoying myself...and the food obviously. We had a sampler of Shochu drinks, which are these delicious infused drinks. Our favorite was the Fuji Apple flavor, although all of them were good. At the same time we were served our appetizer - the Butterfish Tataki with white asparagus yuzu. (Incidentally, the Fuji Apple Shochu really brought out the flavors of the Butterfish Tataki.) Usually butterfish has a muddled flavor - I think that's just the nature of that fish, but their preparation of this fish really cleaned it up. It exploded with flavor - very delicious.\n\nWe also ordered the Hamachi Serrano Chili Maki. This roll has very clean flavors - I enjoyed it very much. Next came the Roka Sushi selection, which are 4 different types of sushi selected by the chef. My only qualm here is that one of the four nigiri given was something we also had a full order of (the Salmon Goma Nigiri). Nonetheless, all of it was good. After that came the full order of Salmon Goma nigiri we ordered, which was sooooooo SO good. My husband usually doesn't like salmon because he thinks it's too fishy, while I ordinarily love salmon. We both loved loved loved this. It was so excellent. I would definitely order it again. Finally, we received the kobe beef, which was also very good. Perfectly cooked medium rare and lots of flavor. It comes with mushrooms which added a great dynamic flavor to the meat, and this yummy creamy sauce in which to dip the meat. Delicious. For dessert, we had the Green Tea Custard. We ordered this mostly out of curiosity. Who's ever heard of a Green Tea flavored custard? It did not disappoint. Light & airy, this custard really impressed us. I only wish I had the black cod because it looked so yummy and other yelpers have raved about it, but oh well. Maybe next time.\n\nAfter the meal, our server apologized for the delay we experienced earlier in the evening. I really appreciated and respected that. It was definitely a good move on his part, and he got a good tip out of it. Later, though, I thought that if they were really sorry they could have comp'd part of our meal. So here's how I came up with the score:\n\n5 for the food, knowledgeable wait staff and nice ambiance\nminus 2 for the huge f*ck up early in the evening\nplus 2 for the apology\nminus 1 for not comping part of our meal\n= 4 (if we could rate in half points, I'd probably give them 3 1/2)\n\nFinal thought: I don't know why we didn't get approached by the wait staff as quickly as the other couple who was seated after us, but I don't believe that people should keep quiet about stuff like that. When you pay for anything at any amount, you should be given the best service possible and if not, the establishments should expect to deal with the consequences for their actions. So, keep it up Yelpers! Use your consumer power!!","L.A. people are so spoiled with wonderful sushi restaurants at nearly every corner - I'm one of those people. But I have to say that Roka Akor has blown most of the L.A. sushi restaurants I've been to out of the water. I don't always rate the restaurants I eat at for various reasons, but I couldn't wait to rate this restaurant. You'll see why...read on please.\n\nRoka Akor is rated as one of the Top 10 sushi restaurants in the U.S. by Bon Appetit, so with that rating plus being from L.A., we were definitely expecting a lot. We were welcomed warmly, seated promptly at the best seat at the sushi bar, and given our menus. We took a gander, and were kind of aghast at the minimal selection of rolls on their menu. (Of course this didn't matter later once we tasted their food - everything is excellent. Don't let this disappoint you, it's excellent food.) A few minutes later, I noticed another couple seated a few seats away from us. Their waitress attended to them right away, and we still hadn't been attended to at that point, so I was immediately pissed off and ready to walk out of the restaurant. My friends who know me well, know that this action would have been true to form. I'm nice, but I'm accustomed to excellent service at all types of establishments. When I don't get it, I get pissed off - that's just who I am and I don't think I'm the only one.\n\nI digress...\n\nI'm glad my husband kept me seated to give the waiter a chance to come over and take our order because I ended up really enjoying myself...and the food obviously. We had a sampler of Shochu drinks, which are these delicious infused drinks. Our favorite was the Fuji Apple flavor, although all of them were good. At the same time we were served our appetizer - the Butterfish Tataki with white asparagus yuzu. (Incidentally, the Fuji Apple Shochu really brought out the flavors of the Butterfish Tataki.) Usually butterfish has a muddled flavor - I think that's just the nature of that fish, but their preparation of this fish really cleaned it up. It exploded with flavor - very delicious.\n\nWe also ordered the Hamachi Serrano Chili Maki. This roll has very clean flavors - I enjoyed it very much. Next came the Roka Sushi selection, which are 4 different types of sushi selected by the chef. My only qualm here is that one of the four nigiri given was something we also had a full order of (the Salmon Goma Nigiri). Nonetheless, all of it was good. After that came the full order of Salmon Goma nigiri we ordered, which was sooooooo SO good. My husband usually doesn't like salmon because he thinks it's too fishy, while I ordinarily love salmon. We both loved loved loved this. It was so excellent. I would definitely order it again. Finally, we received the kobe beef, which was also very good. Perfectly cooked medium rare and lots of flavor. It comes with mushrooms which added a great dynamic flavor to the meat, and this yummy creamy sauce in which to dip the meat. Delicious. For dessert, we had the Green Tea Custard. We ordered this mostly out of curiosity. Who's ever heard of a Green Tea flavored custard? It did not disappoint. Light & airy, this custard really impressed us. I only wish I had the black cod because it looked so yummy and other yelpers have raved about it, but oh well. Maybe next time.\n\nAfter the meal, our server apologized for the delay we experienced earlier in the evening. I really appreciated and respected that. It was definitely a good move on his part, and he got a good tip out of it. Later, though, I thought that if they were really sorry they could have comp'd part of our meal. So here's how I came up with the score:\n\n5 for the food, knowledgeable wait staff and nice ambiance\nminus 2 for the huge f*ck up early in the evening\nplus 2 for the apology\nminus 1 for not comping part of our meal\n= 4 (if we could rate in half points, I'd probably give them 3 1/2)\n\nFinal thought: I don't know why we didn't get approached by the wait staff as quickly as the other couple who was seated after us, but I don't believe that people should keep quiet about stuff like that. When you pay for anything at any amount, you should be given the best service possible and if not, the establishments should expect to deal with the consequences for their actions. So, keep it up Yelpers! Use your consumer power!!",1,0,True,35
"Great double date place that allowed us to bring our dogs to sit at the table outside with us. Although it took a long time to get a table, the beer made up for it. As well as the BBQ chicken. The Sunday special will have me coming back for only the chicken and cornbread. \nDownside was the service, and when we were advertised the BBQ buffet, we ordered seconds and got \""""the last of it,so enjoy\"""". And no chicken. \nGood atmosphere.",N/A,2,1,Skipped,0
"This was the worst service EVER. Especially with Melissa at the counter.\n\nI called 3 times before going down there to make sure that I had everything  I needed  to rent the car. I walked down to their office and had all the paperwork they asked me for and my DEBIT card, which they said they accepted. I showed up and had to wait for her to finish her conversation about going out the night before before she helped me. When she finally turned around and asked how she could help me, I gave her my driver's license and my card and she turns to me and says sorry we can't rent to you using this card, gives me back my card, and turns around to continue talking to her coworker. She did not even tell me why we could not use my card or any other card. I have a credit card, I have other debit cards, but she did not even bother asking me if I wanted to use another card, instead, she just turned around, and continued gossiping. Even if she would have said sorry, can't take this card, do you have another? I would have been ok with it but she was too busy with more 'important' matters. Rude and no way to keep customers. \n\nI left there and just rented at Enterprise. Yes, they were a little bit more, but honestly, it is worth the extra amount if anything just for their service.\n\nWill never make another reservation with them, no matter how good of a deal it is.",Failed to initialize,0,,False,970
"I was waiting for my friend to show up for a concert across the street, and decided to get a quick bite to eat. I always see this place and decided why not. \n\nBig mistake. I walked in and sat at the counter. I had to ask for the counter to be cleaned/wiped, and still ended up wiping it again myself after they finished. Then it took a few minutes before i was greeted. After placing my order, I waited and waited. \n\nOnce the order came, that was the final disappointment. The home fries, were under-cooked. I asked for cheese on them, and they added a few sprinkles of finely shredded cheddar. They barely let the cheese melt. The sausage was ok.  The bacon was 2 teeny weenie strips that appeared to be under-cooked also. \n\nOverall disappointing experience!",Failed to initialize,0,,False,913
"I am yet to try the massage at Spa st. James \nBut I have been there over five times for facial, eyebrow threadings and manicures/ pedicures\n\nUpon arrival you will be ushered to go two stories up after taking off your shoes ( you have a chair to sit on which is a big plus for places in montreal) and given flimsy slippers that you will find hard to keep them on while going up the stairs ( better take them off) \nThe waiting area is cool with the brick walls, magazines and the lemon water on offer however the biggest disappointment is the quality of the treatments that are on offer. \nI have tried the manicures several times in there trying to find the best manicurist but none of the therapists are great \nThe Russian therapist can hardly smile and thinks you can't ask her to shape your nails they way you prefer (she knows better than you think) and she is not open for any suggestions!!! \nThe other two will keep you busy with their sweet talks about their boyfriends and life events to distract you from the bad job they are doing \nThe facial which is done by a lady who does the manicure and the bikini wax ( which I think is gross) is average \nThe only thing I really find it good is the eyebrows threading done by a Turkish therapist who only works two, three times a week and it is hard to get a convenient appointment we her most of the time \n\nPrice wise it is very expensive and treatments are not good ( I am a trained professional myself so I can tell when things are done properly)",Failed to initialize,0,,False,957
"High expectations meet reality.\n\nAnd please someone change that $$ to $$$.\n\nService was so-so, with weak recommendations from the waitress.  Here's what we ordered:\n\n- Escargots de Bourgogne (oven-roasted snails, garlic-herb butter) - pretty good\n\n- Housemade Country Pate (cornichons, whole grain mustard, warm country bread) - a LOT of pate, too little bread, I liked this dish, but talk about disparity b/t the two.\n\n- Chicken Liver Mousse (burgundy red wine mustard, toasted brioche) - same as above, with respect to mousse to bread ratio - too much mousse, too little bread.  I was looking forward to this dish, but that burgundy red wine mustard is just nasty and overpowering), pass!\n\n- Sea Scallops Gratinees (caramelized fennel & onion marmalade, mussel cream) - thin scallops that were tasty, but surrounded by too much cheese.  Should have gone with the entree version instead, sigh...\n\n- Rack of Lamb Special - overpowering mustard sauce on the lamb that was just unpleasant.  The lamb was tender and the au jus was tasty.  Excise the sauce and it is  tasty, but $36 worth of tasty?  No.\n\n- Creme Brulee - this was the best dish of the night, nice and creamy with the right thickness to the sugary top.",Failed to initialize,0,,False,910
"Have to say I have passed this several timds and really excited to finally try it! So sadly disappointed! The pulled pork was decent but the brisket was very fatty and swimming in oil (grease). The mac n cheese was horrible! Dry, almost no cheese and old like I got the last scoop of the night! Cole slaw was more like a bowl of cabbage. No flavor at all and dry!! No sauce or dressing at all! This place is mostly popular at lunch and maybe the food is better then but NOT for dinner!! Really sad to print this......sorry won't be returning or recommending! Price way too high for this low quality :(",Failed to initialize,0,,False,943
Wish there was another one close by. Their delivery employees are reckless drivers. It's hit or miss on the customer service you will receive when placing your order over the phone.,Failed to initialize,0,,False,976
"over rated, over priced and always crowded.",Failed to initialize,0,,False,829
"Jade Palace is a great little gem tucked away in a strip mall near Pinnacle Peak Rd. and Scottsdale Rd.\n\nI recently binged on a bunch of delicious dishes here as a pre-diet feast.  The place was packed with sliver-haired snow birds.  There was some cougar action at the bar which I always love to watch, but now that i think of it, it was more of a Hugh Hefner and his 24 year old bride-to-be action.  I was actually the only cougar there. :)\n\nI digress.  \n\n3 Delicacies is great.  Tender flank steak with tender scallops and tender shrimp.  Crab puffs were awesome and light and flaky but creamy and lovely in the middle.  Fried rice is excellent and they don't skimp on meat if you choose to order it with chicken.  And the chicken was tender.  Generous portions. Again, everything is lovely, yummy, fresh, tender, and most importantly, NOT TOO GREASY, which we all know is the signature of Chinese food. And my Absolut Press was poured in generous manner. :)\n\nIf you are looking for crappy food don't go here.  If you are looking to meet men, go here but expect them to all be over 65. If you are looking to meet younger men and have crappy food, go to Sapporo.",Failed to initialize,1,,False,947
"We have rented a property for two years under the managment of this company.  He has been responsive to all of our phone calls, emails and txt's.  We have had several issues in the two years on our rental property and he has responded to them all.  We have appreciated his managment of our lease and would recommend him to our friends.",Failed to initialize,1,,False,944
"Great friendly vibe. Its a chain but the food and service does not reflect that. Very fresh ingredients, creative choices and amazing service. Great everyday dining due to quality, prices and healthy options.","let down well-disposed vibe. information technology ampere chemical chain just the nutrient and service does not shine that. real fresh ingredients, originative option and awfully service. slap-up unremarkable dining due to quality, cost and level-headed options.",1,0,True,164
"Locals discount.\nAte shrimp, clams, mussels, crab legs, crawfish, prime rib & all sorts of fixings. Some items were not as warm as preferred. Good desserts. Didn't really care for being seated way on far edge in area with out of control kids just because we had a toddler too. She's not typical and quite well mannered.\nUpdated 11/10/14 up all night sick from something I ate. Not pleasant.",Failed to initialize,0,,False,895
"If I could, I guess I would go with 4 1/2 stars? \n\nI came to Vegas for my best friend and my birthday.  We wanted to go to a nice restaurant and ultimately selected RM Seafood.\n\nFirst, 3 out of 4 of us are Top Chef fans and were excited to meet Rick Moonen and chat with him.  He's a very nice man and we talked about the food.  He spent a lot of time on the floor...only thing about that that concerns me is that I know he's a celebrity chef and all, but I hope he had a hand in the food that night.\n\nTwo of us did the prix fixe and two of us didn't.  We ate:\n\nAppetizers:\n-California roll with real crab (mine)\n-Steak tartare with fries\n-Ahi Tuna two ways\n\nMy california roll was better than a typical california roll (with fake crab), but none the less it was a ...california roll. The steak tartare looked excellent and I was told that and the tuna both were.\n\nMain course:\n-Lemon-butter scallops and shrimp with capers\n-Halibut with basil sauce\n-Cioppino (mine)\n\nAll three were delicious!  The halibut was the best...love the clean flavors...the green.  Scallops were seared to perfection.  The cioppino was the weakest of a very strong pool.\n\nDessert:\n-16 flavor ice cream challenge\n-Key lime pie\n\nWe were so full by the time we got to dessert, but hey, how many more times am I going to come?  We had to do the ice cream challenge! We got about 10 correct.  According to the waiter, the average correct is 8.  This was more about the experience as some of the ice cream flavors were truly disgusting.  haha.  We had a great time though.\n\nThe waiter also brought out a little candle with the ice cream for our birthdays! (They didn't sing, which I wouldn't expect or want in a joint like this so it was just right. :) )\n\nI'm not usually a key lime pie fan, but this one was probably the best key lime pie I've ever had.  \n\nThe bill wasn't as unreasonable as some of the other restaurants in Vegas (we also didn't drink though).\n\nAll in all, it was a great experience and perfect low-key moment to a crazed Vegas trip.  I would recommend this restaurant to a seafood loving fan looking for a good, not-outrageously priced but still nice meal for their Las Vegas trip.",Failed to initialize,1,,False,916
"I hate to give this bar and grill such a low rating, but the past few times I have been there, the service has been awful. My (now ex) girlfriend and I stood for 15 minutes waiting for the waitress to come and seat us. This would not have been such a problem had it not been 10 PM and there were only 2 tables with people at them. As far as food goes, it's not bad. Basic bar food, minus the pepper jack burger which is amazing. I will probably not be coming back to this location.",Failed to initialize,0,,False,959
