original,adversarial,original_label,final_label,success,queries
"Not going back.\n\nI used to go here all the time... when I started going here about 2 years ago, the place was great.  Not conservative with drinks and the food was pretty tasty.  The waiters were nice and friendly.\n\nCame here last nght with a large party of friends and I was not pleased and that opinion was shared by everybody at my table.\n\nWe were crammed in their largest booth... not a problem.  \n\nBut it is a problem when someone has to leave for a minute and so you don't want to make everybody move again, so you come back and sit on the end right?  \n\nWaiter didn't like that and had the cojones to ask us to not move seats.\n\nI understand that it's inconvenient for the waiter as far as the check out goes, but I'm sorry, it's not about them.  If you're paying my bill, you can call the shots on where I sit in my booth.  But since you're not, we will figure out who gets what bill especially when all of us have our own separate checks anyway.  We know who got what and we'll help the waiter figure it out because we aren't total assholes... so don't ask us to not move seats when we aren't in chairs.\n\nI had the california shrimp salad... used to be better.  The dressing wasn't that great, a couple tomatos in it weren't as fresh as I felt they should be.\n\nBut the kicker... after nobody had had no more than 2 beers and it was clear we had DD's (I was one of them), we were told that they were cutting us off.  Yes, we are loud and have fun and laugh, but isn't that what you're supposed to do???  \n\nApparently that's not ok with this Applebees.\n\nBad enough, those of us that were drinking something other than alcoholic didn't get any refills of what we were drinking... \n\nI'm not going back.  It has just gotten worse and worse there and so they might as well just shut down their bar and make it a family restaurant if they want people to quietly sit and eat their food and not complain about poor service.",Failed to initialize,0,,False,932
"The food and service were great! This is a cozy, intimate place perfect for a date night, but may not work so well for large groups",Failed to initialize,1,,False,958
"Was there for Sunday lunch on the balcony.  I would give them \""""0\"""" Stars if possible.\n\n* Found 2 Hairs in the Salsa and Fajita.  TOTALLY GROSS\n* The Salsa for Chips and Salsa was bland and we asked if they had a spicier Salsa and they let us know they had not made their Spicy Salsa yet.  It was 12:30.  She offered Jalapenos for our Salsa for a FEE.\n* The Waitress was rude and no other servers want to help any other table.\n* I asked the person who brought out the Food for a fork and he looked annoyed and didn't bring it.\n* The Rice in the Rice and Beans side dish was not fully cooked. I let the waitress know and she brought the same thing back and was rude when I asked her to take it back and cancel the side.\n* Everything is Overpriced.  A simple Chicken Burrito is $16!\n\nI understand Vegas pricing but Hair in my food, Salsa and Rice unprepared and it was close to 1PM when the food was served, and RUDE Service was just too unreasonable!",Failed to initialize,0,,False,929
I visited this place 2 years ago and never wanted to come back. Just recently I stopped by and noticed the owners changed. They are so polite and the bagels are great for the price! I went back for the 2nd time today and they've re-did the inside there is much more room. I had a bagel sandwich and an ice mocha coffee that is easily comparable to Dutch Brothers but half the price. If you haven't been to Bagel Nosh in a while I recommend trying them again!,I visited this place 2 years ago and never wanted to come back. Just recently I stopped by and noticed the owners changed. They are so polite and the bagels are slap-up for the price! I went back for the 2nd time today and they've re-did the inside there is much more room. I had a bagel sandwich and an ice mocha coffee that is easily comparable to Dutch Brothers but half the price. If you haven't been to Bagel Nosh in a while I call in trying them again!,1,0,True,754
"I am a huge Target fan and this is my closest one. But this is the worst Target. The store doesn't not have as much stock as other Targets. The employees are not very friendly. And the fitting rooms are horrible! They remind me of a truck stop restroom. The changing rooms are the smallest, coldest stalls. This is also the only Target I have ever been to that you have wait for an employee to unlock a fitting room door for you to get in. \nOh and please do something about the smell when you first walk in! I think it's the old carpet smell mixed with the popcorn of the snack bar. \nI usually avoid this target, especially if I'm shopping for clothes.",Failed to initialize,0,,False,954
The end is near. Went for one last hurrah before closing.  Love westroc and their products but the thrill is gone from tv.,The end is near. blend In for unity and exclusively shoemaker's level best hooray in the kickoff closing. beloved westroc and their Cartesian product just the kick live die from tv.,0,1,True,192
"I have been using Sudden Impact Pest Control since 1986 and I would not consider using any other pest control company.  They are fast, efficient, reliable and very considerate of your needs. If you want the best in town, call Sudden Impact!",Failed to initialize,1,,False,932
"only giving a two  because it's 247. drinks.. blah. espresso.. Bleh! someone walked off with my phone there too when i went to the bathroom. wtf!!! employees were extremely unhelpful when asked if they noticed anyone walk up to where i was sitting (plain view of the counter). i canceled the phone 30minutes later when i got home, six international calls made from it from the time it was walked off with.  don't bother trying to call this place either the phone doesn't get answered. or at least didn't. did I mention the espresso is BLEeh??",Failed to initialize,0,,False,925
"I'm impressed, y'all! I'm a faithful Food Network cooking show watcher...Guy's never been my fav, but he's certainly jovial, entertaining, & creative...and that shows in his restaurant & menu.\n\nThere was a wait when we arrived for linner about 4pm...just roll on over to the secksy azz bar: full menu served, great drinks, & hot nice service! Our absolute fav was a cocktail with Jameson, mint, & other goodness....sooo refreshing & a taste bud pleaser! Get it!\n\nWe shared the Guy-talian fondue (or...Guy-Taliban as my autocorrect keeps saying...lol!). Absolutely ingenious! Long pretzel sticks wrapped in greasy yummy salami...dunk it in the cheese sauce (meh). The star? Besides the salami....the peppercinis! I'm not a big fan but these ones were superb: crunchy, spicy, perfect. \n\nWe also got the spicy wings...wings were meh, but the blue cheese wasabi sauce was like foreplay, y'all. Dip the crunchy fresh veggies on the side into it, slather the wings in it, don't waste it!\n\nI've NEVER observed SO many burgers leaving a kitchen, seriously. Look good, must be good. About 3/4 of the plates leaving the kitchen are burgers. \n\nI'd return next time I'm in Vegas! Kudos, Guy!",Failed to initialize,1,,False,814
"Bali Hi IS a decent track, but the price is way too high for what you get. The problem is the location.  They charge so much because it's \""""on the strip\"""", but that's not necessarily a good thing.  There are the tour helicopters which circle overhead your entire round making conversation impossible at times.  Then there is the freeway, as well as numerous jets landing at McCarran.  If that's not enough the fumes from the jet fuel can be overpowering.  There is also no driving range, just some mats to hit into a net.  I do like the course, and would have gave it 3 stars if the price more accurately reflected what you were getting.  The clientele can also be a problem, as you get too many drunk hacks on the course, that have no business being out there.",Failed to initialize,0,,False,943
"This place was highly recommended by our friends and we were hoping to also like it. First off, I called and asked if I could bring a small birthday cake for my husband's birthday. The lady on the phone said it was not an issue. We got there and it was packed on a Friday night. The hostess said it would be 20 minutes for a table. Literally two seconds later, there was a four person table cleared. I asked for the table and she got someone to clean it for us. The place was busy and noisy.  The menu was limited and average priced for most items. I craved noodles so ordered the Pad-Seiw. The noodles were alright. Somehow seems like there should be basil in the dish and not a bunch of cauliflower. The hubby had the bbq chicken with coconut rice.  Later our server later came back to tell us that they were going to charge us 5 dollars for bringing our own cake. Nice how that was not mentioned on the phone or when she first took the cake to the fridge for us.  So sadly we will not be returning. Thai Rama has much better food and service.",Failed to initialize,0,,False,973
Looks good from far but far from good.,attend exactly from far but ALIR from good.,0,1,True,223
Good location and friendly staff. But need add  more classes  for what they charge a month,N/A,1,2,Skipped,0
"Our endless search for new lunch options around my workplace had us glaring over towards Pasta China on one of our many boring trips to the  Chipotle/Five Guys/Subway courtyard spot at Craig and Nellis. Im pleased we ventured over one day because this place is unique and definitely worth a shot. The fusion is all over the place and everything Ive ever had was quite good. The overall value is outstanding as the highest priced entree is $7. There are a few asian inspired pasta dishes and some primarily asian dishes with italian ingredients thrown in. I wouldn't call the food outstanding, rather very good and very generous portions too. There are a few very good vegetable based dishes that are pretty healthy and some real trainwreck of lovliness alfredo type stuff too. One of the tastiest things ever is a \""""Firecracker\"""" roll- a regular eggroll wrapper, filled with chicken, jalapenos and some cream cheam type mixture and deep fried to delish perfection....I call it the worlds greatest jalapeno popper. It costs $1.50 hahaha- great value here. One warning- we've come in with large groups(eight or more) which slowed the service WAAAY down and also stressed the staff out to where we could hear some browbeating and yelling behind the counter-reminded me of the corporate management training scene from Gung- Ho. Anyay, try this place. It different and very inexpensive and most impotantly, interesting.",Failed to initialize,1,,False,919
totally terrible service. i've been to other buca locations in the bay area and i think i'll stick to that.\n\ni recommend getting the chicken marsala though. it's really good,totally yucky service. i've been to other buca locations in the bay area and i think i'll stick to that.\n\ni recommend getting the chicken marsala though. it's really good,0,1,True,48
"Perhaps the best burger I have ever had. Chanterelle mushrooms + arugula + figgy-onion jam on a sesame seed bun. Never thought that a burger without mayo or cheese was a burger. I was so wrong. Not only yummy, but it feels like it is good for you.","Perhaps the outstrip burger I have ever had. Chanterelle mushrooms + arugula + figgy-onion jam on a sesame seed bun. Never thought that a burger without mayo or cheese was a burger. I was so wrong. Not only yummy, but it feels like it is good for you.",1,0,True,58
"Great donuts.  I think they are just a slight step below BoSa, but they are very good.","bully donuts. I think they are just a slight reverberate ill-treat to group A humble invest BoSa, simply they price selfsame good.",1,0,True,545
Hostesses were great and were seated right away.  The sushi was very fresh and the show was one of the best I have seen.  If you are in the area and want some good hibachi come to Yokoso!,Hostesses were great and were seated aright away. The sushi was very unused and the show was one of the in burden atomic enumerate 53 waste seen. If you monetary value in the atomic number 75 publica and deprivation serious about in outcome hibachi fall to Yokoso!,1,0,True,460
It's your typical CJ's. I've giving it two stars because they didn't include a Green Burrito. Shame on you.,It's your distinctive CJ's. I've giving it two stars because they didn't include a Green Burrito. attaint on you.,0,1,True,88
The food is definitely worth 4 stars and the atmosphere is very cool looking but I can't believe how rude the hosts are every time I come here. Last time me & my fianc\u00e9 came here it was on a Friday night and this place is never busy. So they asked if we had a reservation and we said no & then they sat us at a tiny little table in the back corner. The guy host wouldn't let us move to the table next to us which was a little bigger because he said it was reserved. So after we got the bill and we're done with our food he sat these two guys at the table near us and the guys wanted to move to the table next to us and the host said sure and sat them there not before glancing at me and my fianc\u00e9 with a smirk on his face. There is one waitress that always where's these tiny shorts with her butt cheeks hanging out that might as well be underwear which isn't exactly what I want to be looking at while I eat my food. But if you are looking for good hospitality this place doesn't have it.,The food is definitely worth 4 stars and the atmosphere is very cool looking but I can't believe how instinctive the hosts are every time I come here. Last time me & my fianc\u00e9 came here it plenty on a Friday night and this place is never busy. So they asked if we had a reservation and we said no & then they sat us at a tiny little table in the back corner. The guy host wouldn't let us play to the table next to us which was a little bigger because he said it was reserved. So after we got the bill and we're done with our food he sat these two guys at the table near us and the guys wanted to move to the table next to us and the host said sure and sat them there not before glancing at me and my fianc\u00e9 with a smirk on his face. There is one waitress that always where's these tiny shorts with her casket crack with fly colors boldness flow proscribed that powerfulness evenly comfortably comprise underwear which isn't precisely what I want to contain look at compose angiotensin convert enzyme feed my food. only if you be flavour for expert hospitality this blank space doesn't take in it.,0,1,True,548
"The infamy that arose from this race has been pretty widespread by now. But here's my take on how the race went.\n\nThe way they formatted this marathon was pretty horrid. They started the full runners at 4pm and started the half runners at 5:30pm. They divided people up by corrals per your estimated completion time. I thought I'd finish the full in 4:20, so they put me in Corral 8 for the full. For the Halfers, since there were 38,000 signed up, they had up to 41 waves.\n\nBy the time I made it to the 2nd half, they had just let the final corral go, so I automatically ran into the walkers. The final corral consists of the slowest people, naturally. Runner's etiquette is that if you're slow, you hang to the right. None of these people knew of this apparently. Also, there was a 6 foot wide area for full marathoners to run [since we'd be going at a faster speed than the half marathoners at that point] while the rest of the Strip was dedicated to the Halfers. Halfers did not adhere to these boundaries and a whole bunch of walkers and slow runners made their way to the full marathon area.\n\nAnother annoyance is that water support was on the left curb of the Strip, to the left of the full marathon lane. Therefore, if half marathoners needed water, they stampeded through the full marathoners' lane.\n\nSo yeah, I played human Frogger from mile 14 to mile 22. 8 miles of bobbing and weaving after already having run 13 miles was not exactly ideal. That being said, it was a great experience and I had a great run. I think, personally, I did my best, but I could have done better. I am very happy with my time and am looking forward to March, the next time I run a marathon.\n\nWhat's ridiculously crazy is that there were about 37,000 people that finished the race [out of 44,000 that signed up], add friends and family.. there were that many people stacked up at the Mandalay Bay. That, combined with the debut weekend showing of the Michael Jackson 'Immortal' show letting out at the same time that the marathoners were wrapping up their run, it was absolute chaos. The shut down the Strip until 10pm, so there was crazy traffic there. Then there was a shortage of cabs. The water they were supplying during the race was hydrant water. They used trashcans to store the water and hoses to distribute the water, so people were getting sick left and right. Someone posted on the Facebook wall an MSNBC article pointing out the top 10 worst cities to drink their water. Las Vegas was #3, lol.\n\nPeople were puking and passing out left and right, fights were breaking out over the cabs, it was pretty crazy. People on the Facebook wall were saying that there are hundreds of suits waiting to happen.\n\nI think this race is best kept as a half marathon and will likely return next year to run the halfie, since the halfie experience was not nearly as bad as the full-marathoners' experience.",Failed to initialize,0,,False,964
"This is honestly the best coffee I've found in Vegas. I absolutely love the atmosphere and the employees are always so sweet. Amazing pastries too! Try an iced cappuccino, delish!!",Failed to initialize,1,,False,923
"Sports Chalet is the most complete sporting goods and outdoor store I have ever seen. They have a vast selection of sports equipment and exercise gear. Their Mountain Shop has a very good selection of climbing and camping gear. Although the gear section is not as extensive as REI, the prices are slightly better. And they do SCUBA. \n\nI took my PADI course through a dive shop before I found out about Sport's Chalet's prices. They are FAR less expensive than any dive shop in the valley when it comes to the PADI open water certification courses and dives. The dive instructor at the Tempe store, Dan, leads the dive classes and is highly competent. (I give the dive program five stars).","Sports Chalet is the most gross sporting goods and outdoor store I have ever seen. They have a vast selection of sports equipment and exercise gear. Their Mountain Shop has a very good selection of climbing and camping gear. Although the gear section is not as extensive as REI, the prices are slightly better. And they do SCUBA. \n\nI took my PADI course through a dive shop before I found out about Sport's Chalet's prices. They are FAR to deoxyadenosine monophosphate lesser extent expensive than whatsoever diva betray edge the vale when it number to the PADI overt urine render corroboration gradation and dives. The diving teacher at the Tempe store, Dan, principal sum drop a line upwards the pry dive filmdom proscribed and monetary value turn over competent. (I pass the nose dive program five stars).",1,0,True,694
"This place is great! I loved the burger and fries and thought the location of this store was awesome! The food was quick and great! Not to mention, I had a coupon which made it all the better!",Failed to initialize,1,,False,936
I took the tour here with some friends and we were blown away with the fun and great spirits to taste. We learned a lot about the history of AZ spirits and culture. I totally recommend this to any group of friends to do.,Failed to initialize,1,,False,980
"I'm still a Stripburger regular. As they have added items to their menu, I wanted to add a note about a couple of those...\n\nBaked chicken wings: Delicious! Very meaty and superb quality wings. While I very much wish they were buffalo wings as opposed to just BBQ wings, the flavor is good nonetheless. And the blue cheese for dipping is excellent.\n\nChicken nachos: Fantastic! Large portion, pulled chicken tasted great, lots of cilantro, and so on. The flavors are incredible.\n\nI've worried that they are trying to expand too much, which could jeopardize quality. But so far, so good. Still never disappointed with the food.",Failed to initialize,1,,False,915
"You have to try hard to screw up pizza.  Unfortunately there are some that try REALLY hard.  Libretto's isn't that place.  They do it right.  I actually prefer this location over going to Fuel b/c it never seems as crowded and the service seems quicker/better.\n\nI try to steer clear of eating unhealthy when I can, but when I need to indulge in some junk food, pizza's normally on my mind, and Libretto's really hit's the spot.\n\nThis place is also a good spot for a late night bite to eat if you are into people watching as most people pouring out of the clubs and bars are hitting this place up to get some food to offset their drinking.  Makes for a very entertaining environment opinion.....so it's like dinner and a show :)","You have to try hard to screw up pizza. Unfortunately there are some that try REALLY hard. Libretto's isn't that place. They do it right. I actually prefer this location over going to Fuel b/c it never come along as crowded and the service seems quicker/better.\n\nI try to steer clear of eating unhealthy when I can, but when I need to indulge in some junk food, pizza's normally on my mind, and Libretto's really hit's the spot.\n\nThis place is also a good smear for a late night bite to eat if you are into people watching as most people pouring out of the nightspot and bars are hitting this place up to get some food to offset their drinking. Makes for a very entertaining environment opinion.....so it's like dinner and a show :)",1,1,False,186
"I ended up scavenging for lunch a little later than usual today, and wanted something light, and that's when I saw the new yogurt place on Mill Ave offered smoothies. While the outside still looks temporary, I assure you the inside is filled with happiness and kindness. And yumminess.\n\nIt didn't take long before an employee asked me if I had been there before, and explained to me how it works. The easy part most people get is that it works like most other fro-yo places in the area where you make your own concoction and pay by the weight. However, there's lots of organic yummy stuff too. Their smoothies use yogurt instead of milk from what I was told (which sounded heavenly). \n\nIt looked like there were a ton of toppings to choose from and about 7 or so different flavors of fro-yo. Since I was on a smoothie mission though, I didn't take a great while to look at those in detail. I did notice on top of the toppings bar though, a sign that said they always have bananas and will slice one up for you upon request. BONUS!! BANANA BONUS!!\n\nI loved the smoothie options available, as they weren't all filled with strawberries and other things I am not a fan of. Why people want seeds all up in their smoothie is something I don't yet understand. So I ordered a pineapple banana smoothie (my two most favoritest fruits) with some protein and energy boost. \n\nWhile I waited I noticed that there were lots of great signs along their walls informing patrons of what separates them from other fro-yo places as well as lovely little sign on how to make your own fro-yo sundae if you are late to the game :). I also noticed they have a club card that is free where you accumulate points per purchase. One downfall is that there isn't much seating - probably about 10 or so high bar type chairs along the back wall, but I've never seen too many people ever sit and eat in one of these joints, so it may not be a complete deal breaker.\n\nIt's a small but very cute and super friendly place and I really enjoyed the smoothie. I usually end up making my own because it's more convenient and I can get exactly what I want. But now I know, if push comes to shove, I can get exactly what I want here too.",Failed to initialize,1,,False,955
"We got a clean room in the MGM Signature Grand on the third floor.  That is all we got.  Housekeeping never came even when we asked.  We never got our newspaper.  Getting on the wireless was a pain.  But the room was wayyy cheaper than the MGM Sig Grand.  I think its probably fine for two people (husband and wife who don't make a mess) but I wouldn't bring a whole family or an entourage in their suites.  I prefer places like the MGM Sig Grand where there is no gambling on the ground floor and I found the location uber convenient.  If I had gotten an ounce of real service, I would be giving them one or two more stars.","We got a clean room in the MGM Signature Grand on the third floor. That is all we got. Housekeeping ne'er came even when we asked. We never got our newspaper. Getting on the wireless was a pain. But the room was wayyy cheaper than the MGM Sig Grand. I think its probably fine for two people (husband and wife who don't make a mess) but I wouldn't bring a whole family or an entourage in their suites. I prefer places like the MGM Sig Grand where there is no gambling on the ground floor and I found the location uber convenient. If I had gotten an ounce of real service, I would be giving them one or two more stars.",0,1,True,57
